[
  {
    "field_name": "acceptable_rep_range_high",
    "display_name": "Acceptable Rep Range High",
    "definition": "Structured field for acceptable rep range high; see the owning table and methodology for interpretation.",
    "data_type": "integer",
    "allowed_values": "",
    "unit": "",
    "nullable": true,
    "example_value": "",
    "validation_rule": "type_must_match",
    "used_in_tabs": "exercise_database"
  },
  {
    "field_name": "acceptable_rep_range_low",
    "display_name": "Acceptable Rep Range Low",
    "definition": "Structured field for acceptable rep range low; see the owning table and methodology for interpretation.",
    "data_type": "integer",
    "allowed_values": "",
    "unit": "",
    "nullable": true,
    "example_value": "",
    "validation_rule": "type_must_match",
    "used_in_tabs": "exercise_database"
  },
  {
    "field_name": "adjustment_triggers",
    "display_name": "Adjustment Triggers",
    "definition": "Structured field for adjustment triggers; see the owning table and methodology for interpretation.",
    "data_type": "string",
    "allowed_values": "",
    "unit": "",
    "nullable": true,
    "example_value": "",
    "validation_rule": "type_must_match",
    "used_in_tabs": "nutrition_strategies"
  },
  {
    "field_name": "affected_record_ids",
    "display_name": "Affected Record Ids",
    "definition": "Structured field for affected record ids; see the owning table and methodology for interpretation.",
    "data_type": "delimited_string",
    "allowed_values": "",
    "unit": "",
    "nullable": true,
    "example_value": "",
    "validation_rule": "type_must_match",
    "used_in_tabs": "change_log"
  },
  {
    "field_name": "affected_tab",
    "display_name": "Affected Tab",
    "definition": "Structured field for affected tab; see the owning table and methodology for interpretation.",
    "data_type": "string",
    "allowed_values": "",
    "unit": "",
    "nullable": true,
    "example_value": "",
    "validation_rule": "type_must_match",
    "used_in_tabs": "change_log"
  },
  {
    "field_name": "allowed_values",
    "display_name": "Allowed Values",
    "definition": "Structured field for allowed values; see the owning table and methodology for interpretation.",
    "data_type": "string",
    "allowed_values": "",
    "unit": "",
    "nullable": true,
    "example_value": "",
    "validation_rule": "type_must_match",
    "used_in_tabs": "definitions_data_dictionary"
  },
  {
    "field_name": "anatomical_function",
    "display_name": "Anatomical Function",
    "definition": "Structured field for anatomical function; see the owning table and methodology for interpretation.",
    "data_type": "string",
    "allowed_values": "",
    "unit": "",
    "nullable": true,
    "example_value": "",
    "validation_rule": "type_must_match",
    "used_in_tabs": "muscle_group_recommendations"
  },
  {
    "field_name": "applicable_exercise_ids",
    "display_name": "Applicable Exercise Ids",
    "definition": "Structured field for applicable exercise ids; see the owning table and methodology for interpretation.",
    "data_type": "delimited_string",
    "allowed_values": "",
    "unit": "",
    "nullable": true,
    "example_value": "",
    "validation_rule": "type_must_match",
    "used_in_tabs": "progression_rules"
  },
  {
    "field_name": "applicable_exercise_types",
    "display_name": "Applicable Exercise Types",
    "definition": "Structured field for applicable exercise types; see the owning table and methodology for interpretation.",
    "data_type": "string",
    "allowed_values": "",
    "unit": "",
    "nullable": true,
    "example_value": "",
    "validation_rule": "type_must_match",
    "used_in_tabs": "progression_rules"
  },
  {
    "field_name": "applicable_male_population",
    "display_name": "Applicable Male Population",
    "definition": "Structured field for applicable male population; see the owning table and methodology for interpretation.",
    "data_type": "string",
    "allowed_values": "",
    "unit": "",
    "nullable": true,
    "example_value": "",
    "validation_rule": "type_must_match",
    "used_in_tabs": "executive_summary"
  },
  {
    "field_name": "applicable_muscle_groups",
    "display_name": "Applicable Muscle Groups",
    "definition": "Structured field for applicable muscle groups; see the owning table and methodology for interpretation.",
    "data_type": "string",
    "allowed_values": "",
    "unit": "",
    "nullable": true,
    "example_value": "",
    "validation_rule": "type_must_match",
    "used_in_tabs": "progression_rules"
  },
  {
    "field_name": "applicable_nutrition_phases",
    "display_name": "Applicable Nutrition Phases",
    "definition": "Structured field for applicable nutrition phases; see the owning table and methodology for interpretation.",
    "data_type": "delimited_string",
    "allowed_values": "",
    "unit": "",
    "nullable": true,
    "example_value": "",
    "validation_rule": "type_must_match",
    "used_in_tabs": "progression_rules"
  },
  {
    "field_name": "applicable_training_levels",
    "display_name": "Applicable Training Levels",
    "definition": "Structured field for applicable training levels; see the owning table and methodology for interpretation.",
    "data_type": "delimited_string",
    "allowed_values": "",
    "unit": "",
    "nullable": true,
    "example_value": "",
    "validation_rule": "type_must_match",
    "used_in_tabs": "progression_rules"
  },
  {
    "field_name": "application_rule",
    "display_name": "Application Rule",
    "definition": "Structured field for application rule; see the owning table and methodology for interpretation.",
    "data_type": "string",
    "allowed_values": "",
    "unit": "",
    "nullable": true,
    "example_value": "",
    "validation_rule": "type_must_match",
    "used_in_tabs": "evidence_conclusions"
  },
  {
    "field_name": "authors",
    "display_name": "Authors",
    "definition": "Structured field for authors; see the owning table and methodology for interpretation.",
    "data_type": "string",
    "allowed_values": "",
    "unit": "",
    "nullable": true,
    "example_value": "",
    "validation_rule": "type_must_match",
    "used_in_tabs": "research_library"
  },
  {
    "field_name": "bulking_adjustment",
    "display_name": "Bulking Adjustment",
    "definition": "Structured field for bulking adjustment; see the owning table and methodology for interpretation.",
    "data_type": "string",
    "allowed_values": "",
    "unit": "",
    "nullable": true,
    "example_value": "",
    "validation_rule": "type_must_match",
    "used_in_tabs": "muscle_group_recommendations|exercise_database"
  },
  {
    "field_name": "calorie_adjustment_type",
    "display_name": "Calorie Adjustment Type",
    "definition": "Structured field for calorie adjustment type; see the owning table and methodology for interpretation.",
    "data_type": "string",
    "allowed_values": "",
    "unit": "",
    "nullable": true,
    "example_value": "",
    "validation_rule": "type_must_match",
    "used_in_tabs": "nutrition_strategies"
  },
  {
    "field_name": "calorie_adjustment_unit",
    "display_name": "Calorie Adjustment Unit",
    "definition": "Structured field for calorie adjustment unit; see the owning table and methodology for interpretation.",
    "data_type": "string",
    "allowed_values": "",
    "unit": "",
    "nullable": true,
    "example_value": "",
    "validation_rule": "type_must_match",
    "used_in_tabs": "nutrition_strategies"
  },
  {
    "field_name": "carbohydrate_guidance",
    "display_name": "Carbohydrate Guidance",
    "definition": "Structured field for carbohydrate guidance; see the owning table and methodology for interpretation.",
    "data_type": "string",
    "allowed_values": "",
    "unit": "",
    "nullable": true,
    "example_value": "",
    "validation_rule": "type_must_match",
    "used_in_tabs": "nutrition_strategies"
  },
  {
    "field_name": "cardio_guidance",
    "display_name": "Cardio Guidance",
    "definition": "Structured field for cardio guidance; see the owning table and methodology for interpretation.",
    "data_type": "string",
    "allowed_values": "",
    "unit": "",
    "nullable": true,
    "example_value": "",
    "validation_rule": "type_must_match",
    "used_in_tabs": "nutrition_strategies"
  },
  {
    "field_name": "change_date",
    "display_name": "Change Date",
    "definition": "Structured field for change date; see the owning table and methodology for interpretation.",
    "data_type": "date",
    "allowed_values": "",
    "unit": "YYYY-MM-DD",
    "nullable": true,
    "example_value": "",
    "validation_rule": "iso_date_yyyy_mm_dd",
    "used_in_tabs": "change_log"
  },
  {
    "field_name": "change_id",
    "display_name": "Change Id",
    "definition": "Structured field for change id; see the owning table and methodology for interpretation.",
    "data_type": "string",
    "allowed_values": "",
    "unit": "",
    "nullable": true,
    "example_value": "",
    "validation_rule": "lowercase_snake_case_persistent_id",
    "used_in_tabs": "change_log"
  },
  {
    "field_name": "change_type",
    "display_name": "Change Type",
    "definition": "Structured field for change type; see the owning table and methodology for interpretation.",
    "data_type": "string",
    "allowed_values": "",
    "unit": "",
    "nullable": true,
    "example_value": "",
    "validation_rule": "type_must_match",
    "used_in_tabs": "change_log"
  },
  {
    "field_name": "comparator",
    "display_name": "Comparator",
    "definition": "Structured field for comparator; see the owning table and methodology for interpretation.",
    "data_type": "string",
    "allowed_values": "",
    "unit": "",
    "nullable": true,
    "example_value": "",
    "validation_rule": "type_must_match",
    "used_in_tabs": "research_library"
  },
  {
    "field_name": "conclusion",